{
  "metadata": {
    "dataset_id": "SAHOOL-YEMEN-FOOD-GRAINS-SOURCE-VERIFIED-V1",
    "version": "1.0.0",
    "created_at": "2026-07-24",
    "language": "ar",
    "source_title_ar": "الدليل الزراعي لمحاصيل الحبوب الغذائية",
    "source_authority_ar": "الهيئة العامة للبحوث والإرشاد الزراعي - الجمهورية اليمنية",
    "source_year": 2022,
    "source_pdf_sha256": "a8e3d204200e09bd02820d427020a8b755facaa32fa638d0e1cdb4a799d45f32",
    "record_count": 29,
    "crop_counts": {
      "قمح": 11,
      "شعير": 3,
      "ذرة رفيعة": 4,
      "ذرة شامية": 5,
      "دخن": 6
    },
    "verification_method": "visual review of rendered PDF pages; no silent correction of source conflicts",
    "operational_policy": "catalog/reference use only; management values blocked from automated decision execution until expert validation"
  },
  "varieties": [
    {
      "id": "YEM-WHT-BAHOUTH-3",
      "crop_code": "wheat",
      "crop_name_ar": "قمح",
      "name_ar": "بحوث 3",
      "name_en": "Bahouth 3",
      "source_pages": [
        6,
        7
      ],
      "source_verification": "visual_pdf_review",
      "catalog_use_status": "source_verified",
      "decision_engine_use_status": "reference_only_not_operational",
      "issue_codes": [
        "WATER_UNIT_CONTEXT_REQUIRES_AGRONOMIST_REVIEW"
      ],
      "production_systems_ar": [
        "مروي",
        "مطري",
        "ري تكميلي"
      ],
      "regions_raw_ar": "مناطق المرتفعات الوسطى ومناطق المرتفعات.",
      "row_spacing_cm": 20,
      "water_raw_ar": "الكمية المثلى مقدرة بـ500 متر مكعب محسوباً فيها المطر؛ ويجود الصنف عند إضافة 400-450 مم موزعة على 5-6 ريات، أو 2-3 ريات تكميلية تحت المطر العالي أو المتوسط.",
      "seed_rate_kg_ha": {
        "min": 120,
        "max": 120
      },
      "sowing_raw_ar": "شتوي: منتصف ديسمبر إلى منتصف يناير في المرتفعات؛ صيفي: يوليو.",
      "fertilization": {
        "nitrogen_total_kg_ha": 100,
        "nitrogen_applications": [
          {
            "timing_ar": "عند الزراعة",
            "fraction_percent": 25
          },
          {
            "timing_ar": "بعد 40 يوماً من الزراعة",
            "fraction_percent": 75
          }
        ],
        "phosphorus_kg_ha": 80,
        "phosphorus_timing_ar": "دفعة واحدة عند إعداد الأرض"
      },
      "weeding_raw_ar": "دورتان؛ الأولى بعد أسبوعين من الإنبات والثانية بعد شهرين.",
      "morphology": {
        "growth_habit_ar": "قائم",
        "leaf_color_ar": "أخضر غامق",
        "tillers_raw_ar": "يتوقف على مدى توفر الرطوبة",
        "days_to_50_flowering": 93,
        "days_to_maturity": 143,
        "plant_height_cm": 73,
        "awn_raw_ar": "متوسط الكثافة - أبيض",
        "grain_color_ar": "أبيض محمر",
        "spike_length_cm": 11,
        "grains_per_spike": 43,
        "thousand_grain_weight_g": 42
      },
      "yield_observations": [
        {
          "product": "grain",
          "value": 3.9,
          "unit": "t/ha",
          "context_ar": "متوسط الإنتاجية الحبية"
        }
      ],
      "special_traits_ar": [
        "منتخب من المشتل الدولي للأصناف المتحملة للجفاف",
        "مناسب لمناطق عالية ومتوسطة الأمطار",
        "متحمل لأمراض الأصداء الثلاثة"
      ]
    },
    {
      "id": "YEM-WHT-BAHOUTH-13",
      "crop_code": "wheat",
      "crop_name_ar": "قمح",
      "name_ar": "بحوث 13",
      "name_en": "Bahouth 13",
      "source_pages": [
        8,
        9
      ],
      "source_verification": "visual_pdf_review",
      "catalog_use_status": "source_verified",
      "decision_engine_use_status": "reference_only_not_operational",
      "issue_codes": [
        "SOURCE_NUMERIC_OUTLIER_TGW_7_43",
        "SOURCE_NUMERIC_OUTLIER_GRAINS_PER_SPIKE_9",
        "WATER_UNIT_CONTEXT_REQUIRES_AGRONOMIST_REVIEW"
      ],
      "production_systems_ar": [
        "مروي",
        "مطري",
        "ري تكميلي"
      ],
      "regions_raw_ar": "مناطق المرتفعات الوسطى ومناطق المرتفعات.",
      "row_spacing_cm": 20,
      "water_raw_ar": "500 متر مكعب محسوباً فيها المطر؛ إضافة 400-450 مم على 5-6 ريات؛ 2-3 ريات تكميلية تحت المطر العالي أو المتوسط.",
      "seed_rate_kg_ha": {
        "min": 120,
        "max": 120
      },
      "sowing_raw_ar": "شتوي: منتصف ديسمبر إلى منتصف يناير؛ صيفي: يوليو.",
      "fertilization": {
        "nitrogen_total_kg_ha": 100,
        "nitrogen_applications": [
          {
            "timing_ar": "عند الزراعة",
            "fraction_percent": 25
          },
          {
            "timing_ar": "بعد 40 يوماً من الزراعة",
            "fraction_percent": 75
          }
        ],
        "phosphorus_kg_ha": 80,
        "phosphorus_timing_ar": "دفعة واحدة عند إعداد الأرض"
      },
      "morphology": {
        "days_to_maturity": 130,
        "days_to_heading": 56,
        "plant_height_cm": 77.5,
        "tillers_mean": 2.6,
        "grain_color_ar": "أبيض محمر خفيف",
        "lodging_resistance_ar": "مقاوم",
        "spike_length_cm": 11,
        "grains_per_spike": 9,
        "thousand_grain_weight_g": 7.43
      },
      "yield_observations": [
        {
          "product": "grain",
          "value": 3.6,
          "unit": "t/ha",
          "context_ar": "متوسط إنتاجية الحبوب"
        }
      ],
      "special_traits_ar": [
        "يزرع في مناطق عالية ومتوسطة الأمطار",
        "طاقة إنتاج جيدة",
        "متحمل لأمراض الأصداء الثلاثة"
      ]
    },
    {
      "id": "YEM-WHT-BAHOUTH-37",
      "crop_code": "wheat",
      "crop_name_ar": "قمح",
      "name_ar": "بحوث 37",
      "name_en": "Bahouth 37",
      "source_pages": [
        10,
        11
      ],
      "source_verification": "visual_pdf_review",
      "catalog_use_status": "source_verified",
      "decision_engine_use_status": "reference_only_not_operational",
      "issue_codes": [],
      "production_systems_ar": [
        "مروي",
        "مطري",
        "ري تكميلي"
      ],
      "regions_raw_ar": "مناطق المرتفعات الوسطى ومناطق المرتفعات.",
      "row_spacing_cm": 20,
      "water_raw_ar": "من أكثر الأصناف تحملاً للجفاف؛ في المناطق قليلة الأمطار تضاف 2-3 ريات تكميلية.",
      "seed_rate_kg_ha": {
        "min": 120,
        "max": 120
      },
      "sowing_raw_ar": "شتوي: منتصف ديسمبر إلى منتصف يناير؛ صيفي: يوليو.",
      "fertilization": {
        "nitrogen_total_kg_ha": 100,
        "nitrogen_applications": [
          {
            "timing_ar": "عند الزراعة",
            "fraction_percent": 25
          },
          {
            "timing_ar": "بعد 40 يوماً من الزراعة",
            "fraction_percent": 75
          }
        ],
        "phosphorus_kg_ha": 80,
        "phosphorus_timing_ar": "دفعة واحدة عند إعداد الأرض"
      },
      "morphology": {
        "growth_habit_ar": "قائم",
        "leaf_color_ar": "أخضر",
        "tillers_raw_ar": "يتوقف على مدى توفر الرطوبة",
        "days_to_50_flowering": 65,
        "days_to_maturity": 130,
        "plant_height_cm": 61,
        "awn_raw_ar": "متوسط الكثافة - أبيض",
        "grain_color_ar": "أبيض",
        "spike_length_cm": 8,
        "grains_per_spike": 41,
        "thousand_grain_weight_g": 36
      },
      "yield_observations": [
        {
          "product": "grain",
          "value": 2.9,
          "unit": "t/ha",
          "context_ar": "متوسط الإنتاجية"
        }
      ],
      "special_traits_ar": [
        "متحمل للجفاف",
        "مناسب للزراعة المطرية عالية ومتوسطة وقليلة الأمطار مع ريتين تكميليتين عند انقطاع المطر",
        "مبكر نسبياً",
        "محبب للمزارعين في المرتفعات الوسطى"
      ]
    },
    {
      "id": "YEM-WHT-AWSAN",
      "crop_code": "wheat",
      "crop_name_ar": "قمح",
      "name_ar": "أوسان",
      "name_en": "Awsan",
      "source_pages": [
        12,
        13
      ],
      "source_verification": "visual_pdf_review",
      "catalog_use_status": "source_verified",
      "decision_engine_use_status": "reference_only_not_operational",
      "issue_codes": [],
      "production_systems_ar": [
        "مروي",
        "مطري",
        "ري تكميلي"
      ],
      "row_spacing_cm": 20,
      "seed_rate_kg_ha": {
        "min": 120,
        "max": 120
      },
      "fertilization": {
        "nitrogen_total_kg_ha": 100,
        "nitrogen_applications": [
          {
            "timing_ar": "عند الزراعة",
            "fraction_percent": 25
          },
          {
            "timing_ar": "بعد 40 يوماً من الزراعة",
            "fraction_percent": 75
          }
        ],
        "phosphorus_kg_ha": 80,
        "phosphorus_timing_ar": "دفعة واحدة عند إعداد الأرض"
      },
      "weeding_raw_ar": "دورتان؛ الأولى بعد أسبوعين من الإنبات والثانية بعد شهرين من الزراعة.",
      "irrigation_stages_ar": [
        "رية الزراعة",
        "مرحلة البادرات",
        "تطاول الساق",
        "التزهير",
        "الطور اللبني",
        "الطور العجيني"
      ],
      "regions_raw_ar": "المرتفعات الشمالية: شبام وبني مطر تحت الري التكميلي؛ عمران وصعدة والجوف تحت الري الكامل.",
      "water_raw_ar": "475-500 متر مكعب خلال نمو المحصول؛ 3-4 ريات تكميلية في المناطق متوسطة إلى قليلة الأمطار.",
      "sowing_raw_ar": "صيفاً: 15-20 يونيو؛ شتاءً: 15 نوفمبر إلى 15 ديسمبر.",
      "morphology": {
        "growth_habit_ar": "قائم",
        "leaf_color_ar": "أخضر فاتح",
        "tillers_mean": 5,
        "days_to_50_flowering": 50,
        "days_to_maturity": 102,
        "plant_height_cm": 67,
        "grain_color_ar": "أحمر باهت",
        "spike_length_cm": 8.3,
        "spikelets_per_spike": 24,
        "grains_per_spike": 40,
        "thousand_grain_weight_g": 40
      },
      "yield_observations": [
        {
          "product": "grain",
          "value": 3.936,
          "unit": "t/ha",
          "context_ar": "تحت الري التكميلي"
        },
        {
          "product": "grain",
          "value": 6.3,
          "unit": "t/ha",
          "context_ar": "تحت الري"
        }
      ],
      "special_traits_ar": [
        "متحمل لأمراض الأصداء",
        "عالي الإنتاجية نسبياً"
      ]
    },
    {
      "id": "YEM-WHT-SHIBAM-8",
      "crop_code": "wheat",
      "crop_name_ar": "قمح",
      "name_ar": "شبام-8",